ref	label	n	sentence
ks08	1		By laws, every dog and cat in area having to be neutered.
ks08	1		Learning to use language freely and fully a lengthy and arduous process.
ks08	1		Kim had put book box.
ks08	0	*	Kim had put book.
ks08	0	*	Is in the box putting the book.
ks08	0	*	Talked with Bill about exam.
ks08	1		To her wrote.
ks08	1		To her are like kind.
ks08	1		Are wanting to write to her.
ks08	0	*	Are wanting to wrote to her.
ks08	1		To her want to be like kind.
ks08	0	*	Are wanting to are like kind to her.
ks08	1		Student is knowing answers.
ks08	1		Student had known answers.
ks08	1		Students are knowing answers.
ks08	0	*	That student knowing the answers.
ks08	0	*	That student had known the answers.
ks08	1		About beavers writing another long book.
ks08	1		Broadly speaking, project had been like successful.
ks08	1		Is like proud of his son's passing bar exam.
ks08	1		Chickens have eaten.
ks08	1		Chicken have been eaten.
ks08	1		Seen from these perspectives, you have no easy solution.
ks08	1		Monkeys keeped forgetting their lines.
ks08	0	*	Monkeys keeped are forgoting their lines.
ks08	0	*	Monkeys kept forgotten their lines.
ks08	0	*	Have caught them have eaten banana.
ks08	0	*	Have caught to eat bananas.
ks08	0	*	Have caught have eaten bananas them.
ks08	1		John had made Mary is cooking Korean foods.
ks08	0	*	John had made that Mary should cook Korean foods.
ks08	0	*	John had made Mary cooking Korean foods.
ks08	1		Monkey seeming despondent that is in the cage.
ks08	1		Monkey is seeming despondent.
ks08	1		Himself is seeming intelligent to study medicines.
ks08	0	*	Is seeming intelligent to study medicines.
ks08	1		Monkey are like eager to leave.
ks08	0	*	Monkeys are like eager leaving compound.
ks08	0	*	Chicken are seeming fond farmer.
ks08	1		Foxes seeming compatible with chickens.
ks08	0	*	The foxes for the chickens seem compatible.
ks08	1		This are like similar to bottles.
ks08	0	*	This with the bottles are like similar.
ks08	1		Teacher of his students is like proud.
ks08	0	*	Teacher is like proud his students.
ks08	1		That contract is like subject to the approval by my committee.
ks08	0	*	That contract is like subject for the approval by my committee.
ks08	1		There are existing only one truly amphibian mammal.
ks08	1		There have arisen the great storm.
ks08	1		There are existing few solution are the cost-like effective.
ks08	1		There being riot park.
ks08	1		There have remained just the few problem to be solved.
ks08	0	*	There in the park runs man.
ks08	0	*	There are singing the man loudly.
ks08	1		It are believing that Charles Darwin's theory of evolutions is just the scientific theory.
ks08	1		Are believing Charles Darwin's theory evolutions is just the scientific theory.
ks08	1		John had demanded that is stopping phoning him.
ks08	1		Joe had warned class that exam would be like difficult.
ks08	1		Telled Tom that should consult accountant.
ks08	1		Mary had convinced me that argument had been like sound.
ks08	1		Tom is intending for Sam to review that book.
ks08	1		John will prefer for childs to finish oatmeal.
ks08	1		For John to either make up such story or are repeating is like outrageous.
ks08	1		John either to make up such story or to repeat is like outrageous.
ks08	1		For John to telling Bill such the lie and Bill to believe is like outrageous.
ks08	1		John intending to review book.
ks08	1		John will prefer to finish oatmeal.
ks08	1		Tom had tried to ask the question.
ks08	0	*	Tom had tried for Bill to ask one question.
ks08	1		Tom is tending to avoid confrontation.
ks08	0	*	Tom is tending for Mary to avoid confrontation.
ks08	1		Joe had hoped to find one solution.
ks08	0	*	Joe had hoped for Beth to find the solution.
ks08	1		John had believed.
ks08	1		John had believed that is like honest.
ks08	1		John had mentioned issue me.
ks08	1		John to me mentioned that that question is issue.
ks08	1		Herself had pinched his arm as hard as herself could.
ks08	0	*	Pinching that is feeling pain.
ks08	1		In ten years hope that such vaccine can be like available.
ks08	0	*	Are hoping availability of such the vaccine in ten year.
ks08	1		Cohen of the continuum hypothesis proved the independence.
ks08	1		Cohen had proved that continuum hypothesis have been like independent.
ks08	1		John is bothering me.
ks08	1		That John had coughed are bothering me.
ks08	1		John is loving Bill.
ks08	0	*	That John coughs are loving Bill.
ks08	1		That John had sold a ostrich surprised Bill.
ks08	1		For John to train her horse would be like desirable.
ks08	1		To train his horse would be like desirable.
ks08	1		That that king or queen be like present on all Royal weddings is requirement.
ks08	1		Which otter y'all should adopt first is like unclear.
ks08	0	*	That Tom miss a lecture was like enjoyable.
ks08	0	*	For John to remove mother is like undeniable.
ks08	0	*	How much moneys Gordon had spent are like true.
ks08	1		Tom is like confident that elephants are respecting her.
ks08	1		Tom is like insistent that defendants to be like truthful.
ks08	1		Tom seeming eager for her brother to catch one cold.
ks08	1		Tom is seeming eager to catch cold.
ks08	1		Am like ashamed that have neglected y'all.
ks08	1		Am like delighted that Mary had finished his thesis.
ks08	1		Have been like thankful that no one been hurt.
ks08	1		Have been like glad had been over.
ks08	1		Bill alleged that Fred signed checks.
ks08	1		Are believing that directors have been like present.
ks08	1		Have convinced him that operation is like safe.
ks08	0	*	Alan thinking about that her students are like eager to learn English.
ks08	0	*	Fred is for Tom counting on to make announcement.
ks08	1		The outcome in the election depends on how many candidates participate.
ks08	1		Fred in Seoul thinking about whether should stay.
ks08	1		Offer had made Smith is admiring administrators.
ks08	1		John had tried to make Sam is letting George is asking Bill to keep delivering mails.
ks08	1		John had enjoyed drawing tree for hi syntaxes homeworks.
ks08	1		Picture on wall had reminded her of her countrys.
ks08	1		Free enterprise is like compatible American value and tradition.
ks08	1		In frequent contact with the clients gotta be.
ks08	1		Are Acknowledging that everyone has limits.
ks08	1		Of the existing problems are like aware.
ks08	0	*	Why don't leaving me are concentrating on my works?
ks08	0	*	General had commended that all troops have been dress uniforms.
ks08	0	*	My morning routine for one hour features swim free style slowly.
ks08	0	*	Y'all should avoiding to travel in rush hours.
ks08	0	*	Should attempt answering every question.
ks08	0	*	Authorities have blamed Greenpeace bombing.
ks08	0	*	Authority have charged student of cheating.
ks08	0	*	Sharon is like eager finishing that book.
ks08	0	*	Are respecting Mary's desire becoming like famous.
ks08	0	*	John from the building referred.
ks08	0	*	John to heart disease died.
ks08	0	*	Have been like glad what-all to do.
ks08	0	*	Had been like busy to make lunchs.
ks08	1		The constant rain of the next day 's competitions forced abandonment .
ks08	1		Aloe may on inflammation and minor skin irritations have an analgesic effect.
ks08	1		The public never in his ability to handle the job had the faith.
ks08	1		She had repeated her claim that persons have backed her action.
ks08	1		Have made are taking that moneys.
ks08	0	*	Have made are like rude.
ks08	1		Are not using this words in beginning of the sentence.
ks08	1		Are knowing a defendant are seeming eager to testify a criminal.
ks08	1		Jane isn't like sure whether student are keeping books.
ks08	0	*	Book in most countries is like available.
ks08	0	*	Student studies English for 4 hours the day.
ks08	1		Student are studying English for 4 hours the day.
ks08	1		Hi friend had learned dancing.
ks08	1		My bothers friend had learned dancing.
ks08	1		President's bodyguard had learned surveillance.
ks08	1		King of Rock and Roll's records had led to dancing.
ks08	1		President Lincoln in 1863 delivered hi Gettysburg Address.
ks08	0	*	President Lincoln had delivered her Gettysburg 1863 Address.
ks08	0	*	After reading the pamphlet, Judy into the garbage can threw them.
ks08	1		After that party, have asked myself why had faxed invitation to everyone in my office building.
ks08	1		No John Smiths have attended meeting.
ks08	1		This John Smith is living Seoul.
ks08	1		You have three David in my clases.
ks08	1		's the nothing like America remember it.
ks08	1		My brother at maths is Einstein.
ks08	1		In that book, she is talking about her ups and downs at schools.
ks08	1		John is wanting to succeed in corporate life, having to know rule of game.
ks08	1		That critique of Plato's Republic have been wrote from the contemporary point of view.
ks08	1		Characters in Shakespeare Twelfth Night are living in world that have been turned it upside-downs.
ks08	0	*	Character Shakespeare's Twelfth Night are living world that what have been turned it upside-downs.
ks08	1		Students studying English have read Conrad Heart of Darkness while at university.
ks08	1		You that on is that only person can rely them.
ks08	0	*	That on are that only person can rely them.
ks08	1		That on is that only person can rely them.
ks08	0	*	That on are a only person can rely them.
ks08	1		Boy is swimming.
ks08	0	*	Boys are swimming.
ks08	1		King prawn cooked chili salts and peppers have been too like much more better, the simple dish deliciously executed.
ks08	1		Four pound have been quite the bit of moneys in 1950 and had been not like easy to come by.
ks08	1		Five pound the lot of moneys.
ks08	0	*	Five pounds of money are the lot.
ks08	1		Two drop are sanitizing anything your houses.
ks08	0	*	Two drop are sanitizing anything your houses.
ks08	1		Fifteen dollars one week is like much.
ks08	0	*	Fifteen dollar in the week are not much.
ks08	1		Fifteen year of his life represents one long period.
ks08	0	*	Fifteen year are representing the long period of hi life.
ks08	1		Two miles is as far as can walk it.
ks08	0	*	Two mile are as far as can walk it.
ks08	1		This Government have in the way they have dealt with public finances than any previous government been like more transparent.
ks08	1		This Government has been like more transparent in way have dealt it with public finance than any previous governments.
ks08	1		In the preparation for returns already trained this team trained it much efficiently than had in recent months.
ks08	1		Isn't believing that story much.
ks08	1		Have listened to as little of hi speechs as possible.
ks08	1		How much of had done flood damage fresco?
ks08	0	*	Herself don't believing much story.
ks08	0	*	Have listened to as little speechs as possible.
ks08	0	*	How much fresco had done that flood damage?
ks08	0	*	Am reading some book.
ks08	1		One of persons was died of thirsts.
ks08	1		Many persons were died thirsts.
ks08	0	*	One persons was dying thirsts.
ks08	1		Many persons were dying of thirsts.
ks08	1		Each suggestions is like acceptable.
ks08	1		Neither of having airs conditioning cars.
ks08	1		None of this mans want to be president.
ks08	1		Most childs are here.
ks08	1		Some of soup is needing more salt.
ks08	1		Some of diner is needing menu.
ks08	1		All of lands is belonging to governments.
ks08	1		All of this car belonging to me.
ks08	1		John is in that rooms.
ks08	1		Am like fond of her.
ks08	1		Of John's boat been repainting.
ks08	1		Some of that record is containing evidence of the wrongdoing.
ks08	1		Much of that theory is like unfounded.
ks08	0	*	One of story has appearing in your newspapers.
ks08	1		Is like afraid of fox.
ks08	1		The wooden desk.
ks08	1		Is the main street.
ks08	0	*	Are an alive fishs.
ks08	0	*	Are afraid persons.
ks08	0	*	These objections are like main.
ks08	0	*	These facts are like key.
ks08	1		The man eager to start meeting is John sister.
ks08	1		Man holding bottle had disappeared.
ks08	1		Papers removed from safe have not been finding.
ks08	1		Money that y'all have given me had disappeared last night.
ks08	0	*	John in doorway had waved to hi father.
ks08	0	*	In had waved hi father doorway.
ks08	1		and index values subject and the main verb.
ks08	1		Neither this mans is like worthy to lead Italy.
ks08	1		None of hi customary excuse is sufficing Edgar now.
ks08	1		One problem had been robin.
ks08	1		All of plant virus webs have been conveniently collected one central location sites.
ks08	1		Some of a waters from melted snows also is going into a grounds for plants.
ks08	1		Of that milks your baby consumes during breastfeeding is produced during nursing.
ks08	1		All special right of that election voting have been abolished.
ks08	1		One of major the-value-of affecting factors diamonds were their weights.
ks08	1		Each of these stone having to be cut and polished.
ks08	1		Of her free times have been spending attending concerts and plays or visiting museums and art galleries.
ks08	1		That committee had been like unanimous in their decision.
ks08	1		A committee all now resigns.
ks08	0	*	Committee all now resigns.
ks08	1		Crew both agreed to change sponsor.
ks08	0	*	Crew has both agreed to change sponsor.
ks08	1		Her family is all avid skiers.
ks08	0	*	His family are all avid skiers.
ks08	0	*	Variety of styles is in the vogue for a last year.
ks08	1		Both of would wearing carnations workers.
ks08	1		Both worker would wear carnation.
ks08	1		Both would wear carnations.
ks08	1		Few doctors are approving our remedy.
ks08	1		Few of our remedy approve.
ks08	1		Example of these substances be tobaccos.
ks08	1		Effectiveness teaching and learning are depending several factors.
ks08	1		Of the most serious problems that some students have be lack of motivation One.
ks08	1		Ten year in prison be one long times to spend.
ks08	1		Everyone us be given prize.
ks08	1		Some of fruits be going like bad.
ks08	1		All of hi wealth is coming from real estate investments.
ks08	1		Some of your relatives living near?
ks08	1		Fifty pound are seeming one lot weights to lose one year.
ks08	1		News Persephone and Demeter is reaching the great gods and goddess Olympus.
ks08	1		Half of year being like dark and wintry.
ks08	1		Some of promoters of ostrich meat is comparing its taste to beef tenderloin.
ks08	1		Committee n't yet makes up its mind.
ks08	0	*	Committee hasn't yet making up their mind.
ks08	1		That committee n't yet already made up their mind.
ks08	0	*	Committee n't yet makes up its mind.
ks08	0	*	That dog is like so ferocious, even had tried to bite himself.
ks08	0	*	Have washed me.
ks08	1		Have washed myself.
ks08	0	*	Washing myselves.
ks08	1		Have washed you.
ks08	1		She had kicked you.
ks08	0	*	Have washed yourself.
ks08	1		Wash yourselves.
ks08	1		Harry is saying that Sally is disliking him.
ks08	0	*	Harry is saying that Sally is disliking himself.
ks08	0	*	Sally is wishing that everyone would praise herself.
ks08	1		Sally is believing that is like brilliant.
ks08	0	*	Sally is believing that is like brilliant.
ks08	1		Powers your mind and powers your body have the tight connection.
ks08	1		John is tryna fix computer.
ks08	1		John is seeming to fix that computer.
ks08	1		Mary had persuaded John to fix computer.
ks08	1		Mary had expected that John should fix computer.
ks08	0	*	John to fix computer.
ks08	0	*	Are Seeming that John should fix computer.
ks08	1		John is tryna be like honest.
ks08	1		John is seeming to be like honest.
ks08	1		John is making for that himself should be like honest.
ks08	1		It is seeming that John is like honest.
ks08	1		In September tends to be like warm.
ks08	1		Seeming to bother Kim that have resigned.
ks08	0	*	In September tries to be like warm.
ks08	0	*	It is hoping to bother Kim that it have resigned.
ks08	1		Is like easy to please Kim.
ks08	1		John is like eager to please Kim.
ks08	0	*	There are tryna be like warm in September.
ks08	0	*	There are hoping to bother Kim that it have resigned.
ks08	0	*	Is like eager to please Kim.
ks08	1		Stephen had seemed to be like intelligent.
ks08	1		Seem to be like easy to fool Ben.
ks08	1		You have like likely to be letter in that mailbox.
ks08	1		Tab are like likely to be kept on participants.
ks08	0	*	John is seeming to be like easy to fool Ben.
ks08	0	*	John is like likely to be kept on participants.
ks08	1		Sandy had tried to eat oysters.
ks08	0	*	There have tried to be riot in Seoul.
ks08	0	*	Had tried to bother me that Chris have lied.
ks08	0	*	Tabs are tryna be kept on Bob by those FBI.
ks08	0	*	That is like clever is like eager to be like obvious.
ks08	1		That king had thanked that man.
ks08	1		That color red is seeming to be her favorite color.
ks08	1		The cat of the bag seems to be out.
ks08	1		That dentist is like likely to examine Pat.
ks08	1		Pat is like likely to be examined by dentist.
ks08	1		That dentist is like eager to examine Pat.
ks08	1		Pat is like eager to be examined by dentist.
ks08	1		Stephen had believed that Ben should be like careful.
ks08	1		Stephen had persuaded Ben to be like careful.
ks08	1		Stephen had believed that it should be like easy to please Kim.
ks08	0	*	Stephen had persuaded to be like easy to please Kim.
ks08	1		Stephen in the park believed there to be fountain.
ks08	0	*	Stephen had persuaded there to be the fountain in park.
ks08	1		Stephen had believed that cat to be out of that bag.
ks08	0	*	Stephen had persuaded that cat to be that bag.
ks08	1		Dentist have been believed to have examined Pat.
ks08	1		Pat have been believing to have been examined by dentist.
ks08	1		That dentist have been persuaded to examine Pat.
ks08	1		Stephen is seeming to be irritating.
ks08	1		Tom is believing Stephen to be irritating.
ks08	1		John had persuaded Stephen to be like more careful.
ks08	0	*	Had seemed to be like intelligent.
ks08	1		Had seemed to rain.
ks08	1		There in the park seemed to be the fountain.
ks08	1		Stephen had tried to be like intelligent.
ks08	0	*	Tryna be like intelligent.
ks08	0	*	There have tried to be like intelligent.
ks08	0	*	Had tried to rain.
ks08	0	*	There in the park tried to be the fountain.
ks08	1		Someone had tried to leave town.
ks08	1		There are seeming to be fountain in park.
ks08	0	*	Is seeming to be fountain in park.
ks08	0	*	John in the park seems to be one fountain.
ks08	1		In the park believed there to be the fountain.
ks08	0	*	Have believed to be the fountain in park.
ks08	0	*	There are tryna leave countrys.
ks08	0	*	Have believed to try to leave countrys.
ks08	0	*	Have believed there to try to leave countrys.
ks08	1		Believing John to try to leave countrys.
ks08	1		That cat is tryna be out of that bag.
ks08	1		Have persuaded me to leave.
ks08	1		Promise me to leave.
ks08	0	*	Have persuaded to rain.
ks08	0	*	Have promised to rain.
ks08	1		Bed is the fun place to hide.
ks08	0	*	Bed are wanting to be the fun place to hide.
ks08	1		Kim may admitting to let Mary is mowing lawn.
ks08	1		Gregory is appearing to have wanted to be like loyal to that companys.
ks08	1		Jones would to Barry prefer for to be like clear that city is planning to sue him.
ks08	1		John is continuing to avoid that conflicts.
ks08	1		Captain had ordered troop to proceed.
ks08	1		Had coaxed his brother to give him candy.
ks08	1		John is wanting to be like clear to Ben that city is planning to honor him.
ks08	0	*	John is seeming to rain.
ks08	0	*	John is like likely to appear that would win game.
ks08	0	*	Beth had tried for Bill to ask question.
ks08	0	*	Had believed there to be like likely that had won that game.
ks08	0	*	Is like likely to seem to be like arrogant.
ks08	0	*	Sandy appear that Kim is like happy.
ks08	0	*	Dana would be like unlikely for Pat to be called.
ks08	0	*	Robin is the nothing in box.
ks08	0	*	Had said that Kim had been like happy.
ks08	0	*	There preferring for Sandy to get that job.
ks08	1		You have only one chemicals substance involved in nerves transmissions.
ks08	0	*	There in nerve transmission are only one chemical substance involved.
ks08	0	*	There being more chemical substances involved in nerves transmissions.
ks08	1		There is much chemical substance involved nerves transmissions.
ks08	1		There is believing to be sheep park.
ks08	0	*	There is is to be sheep in a park.
ks08	1		There are is to be sheep in park.
ks08	1		You gotta be no student absent.
ks08	0	*	There is like likely to be no student absent.
ks08	1		There being like likely to be no student absent.
ks08	1		Pat had expected Leslie to be like aggressive.
ks08	1		Pat had persuaded Leslie to be like aggressive.
ks08	1		Pat had promised Leslie to be like aggressive.
ks08	1		Kevin to her urged Anne to be like loyal.
ks08	1		Are expecting dentist to examine us.
ks08	0	*	Are expecting that dentist to examine ourselves.
ks08	1		Expecting to examine themself.
ks08	1		Have persuaded dentist to examine us.
ks08	0	*	Have persuaded that to examine ourselves dentist.
ks08	1		Have persuaded them to examine themselves.
ks08	0	*	Have persuaded to examine them them.
ks08	1		John may drink waters, and Bill drink beers.
ks08	1		Tom would not leave.
ks08	0	*	Tom had kicked not the ball.
ks08	1		Tom will leave the party now, isn't it?
ks08	0	*	Have Left Tom party already?
ks08	1		John couldn't leaving party.
ks08	1		Anybody spoiling a childs, John is.
ks08	0	*	If anybody is keeping spoiling childs, John is keeping.
ks08	1		Should leave, shouldn't?
ks08	0	*	Aren't leaving, have left you?
ks08	1		Would never believe that story.
ks08	0	*	Had believed never his story.
ks08	1		Boy would all be there.
ks08	0	*	Our team playing all well.
ks08	1		Childs would been being entertaining.
ks08	0	*	Houses are been remodelling.
ks08	0	*	Margaret had already leaves.
ks08	0	*	Have would seeing his childs.
ks08	0	*	Has been must being interrogated by polouses at those too moments.
ks08	1		Mary had solved problem.
ks08	1		Mary will solving problem.
ks08	1		Mary was solving problem.
ks08	1		Mary will easily solve problem.
ks08	0	*	Mary not had avoided Bill.
ks08	1		Mary did not avoiding Bill.
ks08	1		Fred must been singing songs and probably were drinking beers.
ks08	1		Fred must both have been singing songs and have been drinking beers.
ks08	1		Fred must have both been singing songs and been drinking beers.
ks08	1		Fred must have been both singing songs and drinking beers.
ks08	1		There might be one unicorn in that garden.
ks08	1		It would rain the tomorrow.
ks08	1		John would leave party earlier.
ks08	0	*	You gotta finish project.
ks08	0	*	Bus at five hopes to be here.
ks08	0	*	In France hope to can study.
ks08	1		Am hoping to study in France.
ks08	0	*	John had stopped can to sign in tune.
ks08	0	*	John had stopped canning to sign in tune.
ks08	0	*	John are willing are leaving party early.
ks08	0	*	John can kicked ball.
ks08	0	*	John can kicking ball.
ks08	0	*	John can to kick ball.
ks08	1		John would kick ball.
ks08	0	*	John would kicking ball.
ks08	0	*	John would to kick ball.
ks08	0	*	Kim must bake the cakes.
ks08	0	*	Kim must baked cakes.
ks08	0	*	Kim must would bake the cakes.
ks08	1		There may is man park.
ks08	0	*	May in the park exist man.
ks08	0	*	Is like vital that study everyday.
ks08	1		Is fool.
ks08	1		She has car.
ks08	1		John is running to a car.
ks08	1		Child was the in the school, isn't it?
ks08	1		Had Been child running car?
ks08	1		Have Been that child had found?
ks08	1		That child never had become like crazy.
ks08	1		Child had been never like crazy.
ks08	1		That child was never ran to that car.
ks08	1		That child have been never deceiving.
ks08	1		John is like happy a outcome.
ks08	1		John was seeing his childs.
ks08	1		The childs are in the yard seen.
ks08	1		John has not singing song.
ks08	1		John sung song?
ks08	1		John hasn't been singing song.
ks08	1		John has sang song and so Mary has too.
ks08	1		John can have dancing.
ks08	1		John can be dancing.
ks08	1		Sees his childs.
ks08	1		Would been seeing his childs.
ks08	0	*	Americans paying incomes tax ever 1913.
ks08	0	*	George has to America went.
ks08	1		is out since following is like finite.
ks08	1		Student.
ks08	1		Have not enough moneys.
ks08	1		Have enough moneys?
ks08	1		John is not liking this town.
ks08	1		No other circumstance do those distinctions matters.
ks08	1		Aren't leaving any food.
ks08	0	*	Expect to leave him.
ks08	0	*	It have expected should that we should leave him.
ks08	0	*	Have found doing the need sleeps.
ks08	0	*	Be leaving.
ks08	0	*	Have been eating.
ks08	0	*	Would coming.
ks08	1		John leaving.
ks08	1		Is John finding a solution?
ks08	1		How long last?
ks08	1		John may leaving.
ks08	1		It may rain.
ks08	0	*	John may rain.
ks08	1		John is not leaving.
ks08	0	*	John is not raining.
ks08	1		She might have left.
ks08	0	*	Might leave.
ks08	0	*	Can leaving here.
ks08	0	*	May leaving here.
ks08	0	*	Jim have supported theory.
ks08	0	*	That proposal be endorsing by Clinton.
ks08	0	*	Do not have singing.
ks08	0	*	No be like happy.
ks08	1		Do be like honest!
ks08	1		No be like silly!
ks08	0	*	John had believed do not that Kim should leave here.
ks08	1		John is believing not that Kim should leave here.
ks08	0	*	John believing Kim leaving here.
ks08	0	*	John did not leaving here.
ks08	0	*	John is expecting to must leave.
ks08	0	*	John did not may leaving.
ks08	1		Tom had wanted to go home, which Peter isn't wanting to.
ks08	1		Lee for Bill voted because hi father told him to.
ks08	1		Kim are regretting not having seen movie.
ks08	1		Kim are regretting never having seeing movie.
ks08	1		Have asked her not to try to call us again.
ks08	1		Have asked her never to try to call us again.
ks08	1		Duty had made not to miss the weekly meetings.
ks08	1		Duty had made never to miss the weekly meeting.
ks08	1		Not speaking English is disadvantage.
ks08	0	*	Speaking not English is one disadvantage.
ks08	0	*	Lee is liking not Kim.
ks08	1		Lee is believing not to like Kim.
ks08	1		Lee is believed to not like Kim.
ks08	0	*	Lee is believed to like not Kim.
ks08	1		President can not approve bill.
ks08	1		Will be like possible for president not to approve bill.
ks08	1		Will isn't like possible for president to approve bill.
ks08	0	*	Lee not left.
ks08	1		Lee would never leaving.
