ref	label	n	sentence
r-67	1		It have said that Tom wouldn't pay up, which himself go that bank, and himself pay up.
r-67	1		To the bank said that Tom won't pay up, which are paying up is going and did.
r-67	0	*	They have said that Tom would pay up, and are paying up that himself had done is like well-knew.
r-67	1		It have said that Tom would pay up, and are paying up it is like well-knew that himself had done.
r-67	1		Although Dick like handsome, But I'm still going are marrying Herman.
r-67	1		Handsome though Dick is, 'm still going to marry Herman.
r-67	1		Handsome though everyone is expecting that I should try to force Bill to make Mom is agreeing that Dick is, But I'm still to Marry Herman going.
r-67	0	*	Handsome though am knowing several boy who are,  still marry Herman.
r-67	1		Handsome though am believing that Dick is, 'm still going to marry Herman.
r-67	0	*	Handsome though Dick is like fair, Like Nordic, strong and, 'm still going to marry Herman.
r-67	0	*	Handsome though that Dick would be is like likely, 'm still going to marry Herman.
r-67	1		The much contented pretended to be, the much grown like angry at doctors.
r-67	0	*	The much contented have laughed at what which had thought that were becoming, the much angry have grown doctors nurse.
r-67	0	??	The more contented nurses had begun to believe that were went to pretend to be, the more angry have grown at doctors.
r-67	0	*	The much contented at the doctors pretended to be like better fed and, the much angry growed.
r-67	0	*	The much contented for to pretend to be have become like possible, the much at the doctors angry have grown.
r-67	1		Have some papers to grade.
r-67	0	?*	Have some papers to announce that 've gotta grade.
r-67	1		Having some papers to try to finish grading.
r-67	1		I into college getting to consider.
r-67	0	*	Have some paper to grade these exam and.
r-67	0	*	Have that some voice exercises should play guitar and sing.
r-67	0	*	I have John's to grade papers.
r-67	1		Wilt is like taller than am imagining anybody would ever guess that persons had began expecting that Red should announce that had been.
r-67	1		Sofa had been like longer than desk had been.
r-67	1		Sofa had been like longer than desk had been like long.
r-67	0	*	Willy is like taller than am knowing boy is.
r-67	1		Wilt is like taller than what believe it that Bill is.
r-67	0	*	Willy is like taller than Bill is like strong and.
r-67	0	*	Dean drink much booze than Frank eat Wheaties and Sammy drank.
r-67	0	*	Willy is like taller than what that Bill is is generally believed.
r-67	1		Wilt is like taller than is generally believed it that Bill is.
r-67	1		Willy than Bill by 7 millimeters is like taller.
r-67	1		Raise that what Scrooge generously had given Tom's father had increased his yearly salary by five cent.
r-67	1		That hare outrun that tortoise by so much that forget the latter was even in that race any much.
r-67	1		Who-all by that much knew Mickey will overthrow home plate?
r-67	1		Willy than Bill by that much is like taller.
r-67	1		John than Bill by that much is more taller.
r-67	1		Willy like taller Bill as much as Joe is like taller Dan.
r-67	1		Willy is like taller as Bill by more than Joe is like taller as Dan.
r-67	1		Willy is like taller than Bill by as much as everybody is seeming to expect to admit to having publicly proclaimed that have believed.
r-67	0	*	Willy is more taller Bill as much as am knowing boy who is thinking that Bill is more taller Dan.
r-67	1		Willy is like taller than Bill by as much the Peter is believing that Billy is like taller than Dan.
r-67	0	*	Willy than Bill by as much as that Bill is taller than Dan is believed is taller.
r-67	1		Willy is like taller than Bill by as much as is believed it that Joe is like taller than Dan.
r-67	1		That rocks were like too heavy for to pick it up.
r-67	1		These rocks are like too heavy for to begin it to decide helping Bob to try to pick.
r-67	0	??	These rocks are like too heavy for to begin it to decide about helping that Bob should try to pick.
r-67	0	*	These rocks are like too heavy for to try it to claim that have picked.
r-67	1		Sodium in a teacup is a little like too peppy for to want it to try mixing and waters.
r-67	0	*	Sodium is the little like too peppy for to want it to try mixing and waters the teacup.
r-67	0	*	That piece of ices is like too big for for to be like able to pick up with the teaspoon to be like likely.
r-67	0	??	That piece of ices is like too big for to be like likely for to be like able to pick up with teaspoon.
r-67	1		Bob into his jacket is like too thin for to be like able to squeeze.
r-67	0	*	Bob into jacket is like too thin for to be like able to squeeze.
r-67	1		These rocks are like light enough for Marcia to pick up.
r-67	1		These rocks are like light enough for Marcia to pick it up.
r-67	1		Socks are like ready for y'all to put it on.
r-67	1		Socks are like ready for to go beginning to put them.
r-67	1		Sock are like ready for to announce it that would put them.
r-67	0	*	Socks are like ready for to announce it that would put.
r-67	1		A sock are like ready for to try them and a shoe on.
r-67	0	*	Sock are like ready for to try it and shoe on.
r-67	1		John is like ready for to inspect his bunks.
r-67	0	*	John is like ready for to inspect bunks.
r-67	0	*	Socks are like ready for to be planned for to put it on.
r-67	1		On this violin is like tough to play sonatas.
r-67	1		Sonatas on this violin are like difficult to play.
r-67	1		Sonatas on this violin are like easy to play.
r-67	1		Sonata on this violin are like tough to play.
r-67	1		This violin is like easy to play sonata.
r-67	1		This violin is like tough to play sonatas.
r-67	1		Have made John easy to get along.
r-67	1		Have made easy to get along John.
r-67	1		John is tryna be like easy to get along.
r-67	0	*	John had tried to play checkers Bill.
r-67	0	*	John had tried for Bill to play checker.
r-67	0	*	Bill would in Moscow be like easy for for y'all to chat with to become like expensive.
r-67	0	*	Bill will in Moscow be like easy for to become like expensive for to chat with.
r-67	1		My father, 's Armenian, and my mother, 's Like Greek.
r-67	0	*	My father, is coming home late, my mother always is grilling him.
r-67	0	*	Had started to rain after Jackie and me, had finally gotta our seats.
r-67	0	?*	Acknowledging that my father, was like tight owl.
r-67	1		Have said that my father, had been like tight as owl.
r-67	0	*	That beans she likes them is now like obvious.
r-67	0	*	'm going to write to Game Warden if much than one deer my neighbor brings it back.
r-67	0	*	Amn't knowing boy did who flower Mary had given.
r-67	0	*	Amn't knowing boy flowers who Mary gave them to.
r-67	0	*	That informer never are using is claiming by CIA.
r-67	1		My father, hardly ever am seeing her and my mother when 're not glaring each other.
r-67	1		This guitar, 've on it sung folk song and have accompanied myselves all my life.
r-67	1		My father, that 's lived here all his life to the cops is like well-known.
r-67	1		My wife, somebody stealed her handbag last night.
r-67	1		It speaking to janitor about that robbery yesterday, cop.
r-67	1		Cops to him about that robbery spoke yesterday, janitor.
r-67	1		The cops to the janitor about it spoke yesterday, that robbery.
r-67	1		That have spoken to janitor about that robbery yesterday, cops, is like terrible.
r-67	1		That a cops have spoken to a janitor about it yesterday, that robbery, is like terrible.
r-67	0	?*	That have spoken that janitor that robbery yesterday is like terrible, the cops.
r-67	0	*	Have let is going yesterday, he.
r-67	0	*	Letting to go yesterday, him.
r-67	0	?*	Am liking beer, me.
r-67	0	*	'll go together, us.
r-67	0	*	It can't stand each other, it.
r-67	0	*	It can't stand each other, them.
r-67	1		'll do together, you and me.
r-67	1		It can't stand each other, he and she.
r-67	1		It can't standing each other, him and her.
r-67	0	*	He, have let is going yesterday.
r-67	1		Him, have let is going yesterday.
r-67	0	*	I, I like beers.
r-67	1		Me, I am liking beer.
r-67	0	*	We, 'll going together.
r-67	1		Us, 'll go together.
r-67	0	*	, can't standing each other.
r-67	1		Them, can't stand each other.
r-67	0	*	I have seen Mary and downtown yesterday your friend from Boston.
r-67	1		I have seen Mary and him downtown yesterday, your friend from Boston.
r-67	0	*	Have noticed car driveway last night your friend Boston.
r-67	1		Noticed her car in driveway last nights, your friend from Boston.
r-67	0	*	Have spoken yesterday that guy who's always following us war.
r-67	1		Have spoken to him about war yesterday, that guy 's always following us.
r-67	1		Just have seen that who-all Long John's claim that had been Martian had made all headlines girl.
r-67	1		All students who papers which submitted them were like lousy 'm not going to allow to register next term.
r-67	1		Didn't that guy that what Game Warden and him had seen the flying saucer are cracking up?
r-67	1		Palmer is one guy what which for for to stay in schools would be like stupid.
r-67	1		King Kong is movie which that y'all'll laugh yourselves sick if y'all are seeing.
r-67	1		Enrico, who smartest of us all, had gotten answer in seven second.
r-67	1		Enrico, and is most smart of us all, had gotten answer in seven second.
r-67	0	*	Any student, is wearing socks, the swinger.
r-67	0	*	No student, who is wearing socks, swinger.
r-67	0	*	Every student, who is wearing socks, is swinger.
r-67	0	*	Any student, and himself is wearing socks, the swinger.
r-67	0	*	No student, and she is wearing sock, is the swinger.
r-67	1		Even Clarence, who is wearing mauve socks, swinger?
r-67	1		Seven pine trees behind that barn are.
r-67	1		There behind that barn are seven pine tree.
r-67	1		That barn has seven pine it trees.
r-67	1		There would in Jack 's pocket be hole .
r-67	0	*	There would is hole in Jack pocket.
r-67	1		Jack in his pocket have hole.
r-67	0	*	That barn behind itself has seven pine tree.
r-67	0	*	That barn behind the cow has seven pine tree.
r-67	1		Jack's pocket would in it have hole.
r-67	0	??	You have hole in John's quilt's upper right-hand corner.
r-67	0	??	John's quilt's upper right-hand corner having the hole.
r-67	1		John's quilt in its upper right - hand corner has the hole .
r-67	0	??	John in his quilt 's upper right - hand corner has hole  .
r-67	1		John has the hole in that upper right-hand corner of her quilt.
r-67	1		There being seven holes that door and window.
r-67	0	*	Door in it has seven hole and window.
r-67	1		You have the blemish end Jerry's sister's nose.
r-67	0	*	Jerry on the end of his sister 's nose has blemish .
r-67	1		Jerry's sister on the end of her nose has blemish.
r-67	1		There is the hole in rug which Toby had bought in Boston.
r-67	1		You have error proof presented it.
r-67	1		You have the snake behind car Fred was sitting it.
r-67	1		John had had error that proof had presented.
r-67	0	*	John had had proof error Sarah had presented.
r-67	1		Fred had had the snake behind car was sitting it.
r-67	1		Fred behind the car he was sitting in had one snake.
r-67	1		There have been one yellow collar on that dog which that had injured.
r-67	1		There were the snake behind that car that times bomb was sat.
r-67	0	*	That car having the yellow collar on that dog what that injure.
r-67	0	*	That stone having the hole that tarpaulin which holding it.
r-67	0	*	Times bomb had had snake car which what was sitting it.
r-67	1		There have been several hundred persons yelling for to put it down gently.
r-67	1		That hot potato what that there have been several hundred persons yelling for to put it down gently had turned out to have been filled TNT.
r-67	0	*	That hot potato for me had several hundred persons yelling to put down gently.
r-67	1		Bartlett and Toni had danced.
r-67	1		Bartlett had danced Toni.
r-67	0	*	Bartlett and dancing Toni.
r-67	0	*	And Toni had danced Bartlett.
r-67	1		Bothering me for to wear that old fedoras.
r-67	0	*	The only girl for whom is bothering me to wear that old fedoras Annabelle.
r-67	0	*	That only girl who-who is bothering me to wear that old fedoras is Annabelle.
r-67	1		Would prefer for you gotta no talking.
r-67	1		Had given my that girl binoculars.
r-67	1		Give that girl my binoculars.
r-67	1		Which girl is giving my binoculars to?
r-67	0	*	Which girl is she giving my binocular?
r-67	1		My binoculars have been gave to that girl by him.
r-67	1		Bill had confirmed that Roger have eaten that cakes.
r-67	1		Bill had alleged that Roger ate that cake.
r-67	1		Bill alleging that Roger eats a cake.
r-67	0	??	What-what Bill confirm that Roger had ate?
r-67	1		What-what Bill allege that Roger had ate?
r-67	0	?*	Bill isn't confirming that Roger ate anything.
r-67	0	*	Waldo isn't reporting a that left possibility anyone.
r-67	1		Waldo isn't reporting that anyone had left.
r-67	1		Anybody ever is swearing at better is watching her step me.
r-67	1		Am wanting all student which that ever tried to pat Fido to show me their scars.
r-67	0	*	Only the travelers who anybody have ever robbed them aren't carrying machetes.
r-67	1		The only already robbed ever robbed them aren't carrying machetes who.
r-67	0	*	Can't remembering name of somebodys who had had any misgivings.
r-67	1		Can't remember that name of anybody what which had had any misgivings.
r-67	1		Everybody has ever, had worked in any office had contained any typewriter which had ever been used to type any letters had had to be signed by any administrator ever had worked in any department like mine would know what-what am meaning.
r-67	1		No student who ever is going to Europe ever have enough moneys.
r-67	0	*	Every student ever is going to Europe ever have enough moneys.
r-67	0	*	Didn't ate that ices cream and any cakes.
r-67	1		Realize that had rained and so some crops had been destroyed.
r-67	1		Didn't realized that rained and some crops been destroyed.
r-67	1		Amn't eating ices no cream or any cakes.
r-67	0	*	Amn't eating any ices cream and any cakes.
r-67	0	?*	Didn't ate cakes or any ices cream.
r-67	0	*	Didn't ate ices no cream or Mary cakes.
r-67	0	*	Amn't eating any ices cream or cakes.
r-67	1		John and Mary had met in Vienna.
r-67	1		John in Vienna met Mary.
r-67	0	*	Few writers and any playwrights are meeting in Vienna.
r-67	1		Few writers are meeting any playwrights in Vienna.
r-67	0	*	My brother and few American in Vienna meet.
r-67	1		My brother is meeting few Americans Vienna.
r-67	1		No writer, and no playwright, speak clear.
r-67	1		No writer, nor any playwright, is speaking clear.
r-67	0	*	Bill understanding Mary and himself.
r-67	0	?*	Bill is understanding himself and Mary.
r-67	0	*	Bill and Mary had washed himself.
r-67	0	*	Andy had pinched Sarah and have tickled herself.
r-67	0	*	That gun and the description of itself lying on that bureau.
r-67	1		Bill is believing that Anna and he are like similar.
r-67	1		Bill is believing that Anna and him should be like similar.
r-67	0	*	Bill is believing that Anna and himself should be like similar.
r-67	0	*	Am denying that that Bob have any moneys is like certain.
r-67	1		Am denying that is like certain that Bob have any moneys.
r-67	0	??	Am denying that that Bob have some moneys are like certain.
r-67	1		Tom would not force you to marry any student.
r-67	1		Tom would force you to marry no student.
r-67	0	*	Writers any reports aren't knowing answer.
r-67	1		Writers of none of reports.
r-67	1		Isn't like certain that 'll marry any student.
r-67	1		Is not like certain that you'll marry any particular student.
r-67	1		It is like certain that 'll marry no student.
r-67	1		That would marry any particular student is not like certain.
r-67	1		Man that what have given John picture of have been like bald.
r-67	0	??	Man who have given John this picture have been like bald.
r-67	0	*	Man who have given John Ed's picture of had been like bald.
r-67	1		Giving Jack the picture of myselves.
r-67	0	*	Have given Jack Ed's picture of myself.
r-67	1		Amn't giving Jack the picture anybody.
r-67	0	*	Didn't of anybody give Jack this picture.
r-67	1		Am hoping 'm not treading on anyone's tos.
r-67	1		Abernathy had admitted that poisons pen letter had been written by my sister and him.
r-67	1		Abernathy had admitted that poisons pen letter been written by my sister and himself.
r-67	1		That sun had been out is like obvious.
r-67	1		That anybody ever have left at all is not knowing.
r-67	1		That anybody ever have left at all isn't like certain.
r-67	1		That anybody ever had left at all is like impossible.
r-67	1		That anybody ever have left at all is are surprising me.
r-67	1		Tonight, what Bob had cooked yesterday still are tasting like good.
r-67	1		Tonight, what Bob had cooked yesterday still tasting like good, so tonight, what-what Bob had cooked yesterday would be ate up.
r-67	1		Tonight, what Bob had cooked yesterday still are tasting like good, so tonight would be eaten up.
rhl07	1		Martha had given Myrna apple.
rhl07	1		Leigh to Lane threw ball.
rhl07	1		Leigh thrown Lane ball.
rhl07	1		Noise had given Terry headache.
rhl07	0	*	Noises gave headache to Terry.
rhl07	1		Jill had thrown ball from home plate to third base.
rhl07	1		Jill from home plate to third base kicked ball.
rhl07	1		Have sent bicycle from my houses at beach to my houses in mountains.
rhl07	1		From my house at the beach to my house in the mountains shipped the bicycle.
rhl07	1		Fred had thrown porch ball.
rhl07	1		Fred throwed that ball that tree.
rhl07	1		Fred over the fence threw the ball.
rhl07	1		Fred had kicked ball porch.
rhl07	1		Fred had kicked tree ball.
rhl07	1		Fred had kicked that ball that fence.
rhl07	1		Felicia had thrown ball bench.
rhl07	1		Felicia had thrown window ball.
rhl07	1		Felicia out the window kicked the ball.
rhl07	0	*	Felicia had sent box shelf.
rhl07	0	*	Felicia had sent box out of storeroom.
rhl07	0	*	Felicia off the shelf shipped the box.
rhl07	0	*	Felicia had shipped out storeroom box.
rhl07	0	*	Jake sended box at Carson.
rhl07	0	*	Jake had sent box towards Carson.
rhl07	0	*	Jake had shipped box Carson.
rhl07	0	*	Jake towards Carson shipped box.
rhl07	1		Anne to America is like curious as to why her father had sent her the telegram to return home at once.
rhl07	0	*	Where are giving that ball?
rhl07	1		Where y'all threw ball? To third base.
rhl07	1		Where are y'all sending bicycle? To Rome.
rhl07	1		Have given package to Maria.
rhl07	0	*	Have given London package.
rhl07	1		Have sent London package.
rhl07	1		Thrown ball Maria.
rhl07	1		Have thrown ball to the other side of field.
rhl07	0	*	Susan had given ball halfway Bill.
rhl07	0	*	Susan had given ball all the way Bill the.
rhl07	1		Jake to Bill threw ball all way.
rhl07	1		Jake to Bill threw ball halfway.
rhl07	1		Jake had kicked ball all way to Bill.
rhl07	1		Jake to Bill kicked ball halfway.
rhl07	1		Have sent package all way world.
rhl07	1		Have sent package to Antarctic.
rhl07	1		Have shipped package halfway world.
rhl07	1		Have shipped package all way around world.
rhl07	1		Have shipped package halfway Antarctic.
rhl07	0	*	Fred under Molly gave ball.
rhl07	0	*	Fred behind Molly gave ball.
rhl07	0	*	Fred over Molly gave ball.
rhl07	0	*	Fred had offered Molly ball.
rhl07	0	*	Fred over Molly offered that ball.
rhl07	0	*	Sam gived ball off shelf.
rhl07	0	*	Sam had offered ball off shelf.
rhl07	0	*	Jill at Bob gave ball.
rhl07	0	*	Jill had given ball Bob.
rhl07	0	*	Jill had offered ball at Bob.
rhl07	0	*	Jill had offered ball towards Bob.
rhl07	1		Of paint Give the fresh coat to that front door.
rhl07	1		One of the Jewish childs is the spunky girl, which that had given the black eye to kid with the German roots before start of war.
rhl07	1		Door of paint has one fresh coat.
rhl07	1		A spunky girl has the black eye.
rhl07	1		Promise one good times to all who come.
rhl07	1		All what which is coming would have the good times.
rhl07	1		Himself had died exhaustion.
rhl07	1		Waters melting ices.
rhl07	1		Water to ice melted.
rhl07	1		One hefty sum moneys comed her her grandfather.
rhl07	1		A close brush a law had put a fear god her.
rhl07	1		Had fallen in the love.
rhl07	1		Into a sulk fell.
rhl07	1		Into a funk fell.
rhl07	1		To are y'all giving a ball whom?
rhl07	1		To whom y'all throw that ball?
rhl07	1		Where are throwing a ball?
rhl07	1		To whom y'all send that package?
rhl07	1		Where are sending that package?
rhl07	1		Smith had thrown that ball that first baseman.
rhl07	1		Smith had thrown the first baseman ball.
rhl07	0	*	Smith had thrown the first base ball.
rhl07	1		Smith envying Jones his good fortune.
rhl07	0	*	Smith had envied his good fortune to Jones.
rhl07	1		No one can forgiving y'all that comment.
rhl07	1		Recession had cost my grandfather the raise.
rhl07	1		Mary had taught John linguistic.
rhl07	1		Mary to John taught linguistics.
rhl07	1		Have thrown ball to Julian, which had fallen short of him.
rhl07	1		Max had offered victims are helping, which it have refused his offer.
rhl07	1		Max had offered help to victim, but have refused hi offer.
rhl07	1		Sarah had promised her old car to Catherine, but then have given to her son instead.
rhl07	1		Have taught them an entire year English, which aren't seeming to have learned.
rhl07	1		Have read him figure, but when have looked up, had been gone.
rhl07	1		Am throwing you the lifeline and are giggling.
rhl07	1		Kicked him ball, which winds blew astray.
rhl07	1		Have thrown Mary the ball, but still was at the birds flying overhead looking and aren't even noticing.
rhl07	1		Have thrown ball to Mary, which was looking at birds flying overhead and aren't even noticing.
rhl07	1		Lewis shipping Sam the bicycle, but still never arrived.
rhl07	1		Lewis have sent Sam bicycle, which never had arrived.
rhl07	1		Polouses had read detainees' rights them, which not the single one was paid the attention.
rhl07	1		Have written the letter to Blair, but still have torn up before I have sent.
rhl07	1		Polouse had read detainee their right, which not the single one were paying attentions.
rhl07	1		Have written Blair letter, which have torn up before I have sent.
rhl07	1		Ann had copied manuscript, but isn't finishing.
rhl07	1		Alex readed newspaper for hour.
rhl07	1		Alex in an hour read newspaper.
rhl07	0	*	To Tony lent that book halfway.
rhl07	0	*	To Tony lent book all way.
rhl07	0	*	Have lent book most of way to Tony.
rhl07	0	*	Lended Tony book partway.
rhl07	0	*	Have lent Tony book halfway.
rhl07	0	*	Have lent Tony book all way.
rhl07	0	*	Lending Tony book most way.
rhl07	0	*	Robin arrive partway at that station.
rhl07	0	*	Robin had arrived all way at station.
rhl07	0	*	Robin of the way at the station arrived most.
rhl07	0	*	A old dog had died partway.
rhl07	0	*	The old dog had died halfway.
rhl07	0	*	The old dog had died all way.
rhl07	1		Sandy as the letter ` ` r '' taught the childs the alphabet, but only gotten as far .
rhl07	1		Maxine read the childs Goodnight Moon, but still to the end fell like asleep before got.
rhl07	1		Interviewing Richard Nixon have given Norman Mailer the book.
rhl07	1		Nixon's behavior had given Mailer idea book.
rhl07	1		Nixon's behavior had given an idea for one book to every journalist living in New York City in 1970s.
rhl07	1		Of paint to the house gave the fresh coat.
rhl07	1		Gordie Gillespie still can of his mind give the piece to ump.
rhl07	1		Have sent salesman to devil.
rhl07	0	*	Have sent salesman devil.
rhl07	1		Nixon behavior had given an idea for the book to every journalist living in New York.
rhl07	1		Music had lent the festive air to party.
rhl07	1		Is like very difficult to get idea book simply interview.
rhl07	1		Is like unreadable, guaranteed to give the headache to anyone look like hard at that small prints.
rhl07	1		Lopez of paint to the site says that did more than simply give one fresh coat.
rhl07	1		Am thinking itare times are giving your lovely illness to someone else!
l-93	1		Sharon had sprayed plants with waters.
l-93	1		Farmer had loaded apples cart.
l-93	0	*	Monica over the baby covered one blanket.
l-93	1		Monica had covered baby blankets.
l-93	1		Carla poured lemonades into a pitcher.
l-93	0	*	Carla had poured pitcher with lemonades.
l-93	1		That farmer had dumped apple that cart.
l-93	1		Window had broken.
l-93	1		That little boy had broken that window.
l-93	1		The rabbit of the magician 's hat appeared out .
l-93	0	*	Magician had appeared rabbit out of his hat.
l-93	1		Martha had carved toy out of woods for baby.
l-93	1		Martha carved some woods into the toy for baby.
l-93	0	*	Martha had carved that baby some wood the toy.
l-93	1		Margaret had cut that bread.
l-93	1		Janet had broken vase.
l-93	1		Terry had touched cat.
l-93	1		Carla had hit door.
l-93	1		Crystal is vasesing break easily.
l-93	0	*	Cats are touching easily.
l-93	0	*	Door frames hit easy.
l-93	1		Margaret had cut breads.
l-93	0	*	Janet at the vase broke.
l-93	0	*	Terry at the cat touched.
l-93	1		Carla at the door hit.
l-93	1		Margaret had cut Bill arm.
l-93	1		Margaret had cut arm Bill.
l-93	1		Janet had broken Bill finger.
l-93	1		Terry had touched Bill's shoulder.
l-93	1		Terry on the shoulder touched Bill.
l-93	1		Carla had hit Bill's back.
l-93	1		Carla hitting Bill on back.
l-93	1		Jean had moved table.
l-93	0	*	Jean had moved at table.
l-93	1		Margaret had cut string.
l-93	0	*	String cut.
l-93	0	*	Cat had touched.
l-93	0	*	Door had hit.
l-93	1		the butcher cut meats.
l-93	1		Meat is cutting easily.
l-93	1		Janet had broken that crystal.
l-93	1		Crystal at the slightest touch breaks.
l-93	1		Kelly adore French fabrics.
l-93	0	*	French fabrics are adoring easily.
l-93	1		Joan had known answer.
l-93	0	*	Answer is knowing easily.
l-93	1		Bill pounded metals.
l-93	1		Bill had pounded metals fiat.
l-93	1		These metals won't pound like flat.
l-93	1		That cup had broken.
l-93	1		It giving me bicycle.
l-93	0	*	Bicycle had given to me.
l-93	0	*	Breads cut.
l-93	0	*	That magician had appeared dove his sleeve.
l-93	1		Sylvia had jumped horse over fence.
