ref	label	n	sentence
c_13	1		Fiona must not eating the sauteed candy canes.
c_13	1		Fiona not already ate the sauteed candy cane.
c_13	1		Can Fiona eat are sauteeding candy canes?
c_13	0	*	I wanting that she should leave.
c_13	0	*	I have wanted should leave.
c_13	0	*	I have wanted if should leave.
c_13	1		Have wanted to leave.
c_13	1		Have wanted to leave.
c_13	0	*	Heidi investigate that John eat cauliflower.
c_13	0	*	Heidi had investigated John had eaten cauliflower.
c_13	1		Heidi had investigated whether John had eaten cauliflower.
c_13	1		Heidi investigated if John eaten cauliflower.
c_13	0	*	Heidi had investigated John to eat cauliflower.
c_13	0	*	Heidi had investigated to eat cauliflower.
c_13	1		John had said Heidi have been obsessed broccolis.
c_13	0	*	John had said if Heidi have been obsessed with broccolis.
c_13	0	*	John had said Heidi to eat broccolis.
c_13	1		Andy had promised that would go.
c_13	1		Andy had promised would go.
c_13	0	*	Andy had promised if will go.
c_13	0	*	Andy promise us to go.
c_13	1		Andy had promised to go.
c_13	1		If have been a rich man, 'd buying diamonds ring.
c_13	0	*	If the rich man, 'd buy the diamonds ring.
c_13	1		Rory eat.
c_13	1		Rory had eaten muffins.
c_13	1		Muffins have been ate.
c_13	1		Rory ate muffins.
c_13	1		Rory eats muffins.
c_13	1		Rory must eaten muffins.
c_13	1		Rory may be eating muffins.
c_13	1		Rory would eat a muffins.
c_13	1		Rory is eating muffins.
c_13	1		Rory eating muffins.
c_13	1		Rory can have been eating muffins.
c_13	1		Muffin can have been being ate.
c_13	1		Tuna had been being ate.
c_13	1		Calvin would eating.
c_13	1		Tuna would be eaten.
c_13	1		Calvin would be eating.
c_13	1		Calvin would have eaten.
c_13	1		Tuna would be being ate.
c_13	1		That tuna would been eaten.
c_13	1		Calvin would have been eating.
c_13	1		Calvin was ate.
c_13	1		Calvin had eaten.
c_13	1		Calvin had been eating.
c_13	1		Tuna must have been eating.
c_13	1		That tuna would have been being eaten.
c_13	1		Not eats yet today.
c_13	1		Have never seeing this movie.
c_13	1		Never having the pen when am needing.
c_13	1		Always love peanut butter.
c_13	1		Am not loving peanut butter.
c_13	1		Martha often thinks Kim hate phonologys.
c_13	1		Like peanut butter?
c_13	1		Always hated peanut butter?
c_13	1		Always thinking dirty thought?
c_13	1		Bradley had left.
c_13	1		Stacy had left Tucson.
c_13	1		John leaved her wife.
c_13	0	*	I am wanting Bradley had left.
c_13	0	*	John is thinking that left.
c_13	1		That John would leave is like likely.
c_13	1		Is like likely that John would leave.
c_13	1		Policeman had kissed puppy.
c_13	1		Puppy have been kissed by policeman.
c_13	1		That puppy have been kissed.
c_13	1		John had laughed.
c_13	1		That audience had laughed.
c_13	0	*	Bill is like likely John to hit.
c_13	0	*	Have been kissing that puppy.
c_13	1		Jennifer had swatted Steve.
c_13	1		Steve swatting Jennifer.
c_13	1		Had swatted him.
c_13	1		Had swatted her.
c_13	1		I am walking.
c_13	1		Y'all are walking.
c_13	1		Is like likely that Patrick had left.
c_13	1		That Patrick leave is like likely.
c_13	0	*	Patrick is like likely that left.
c_13	0	*	Is like likely Patrick to leave.
c_13	0	*	Patrick to leave is like likely.
c_13	1		Patrick is like likely to leave.
c_13	1		She had kissed him.
c_13	1		Have been kissed.
c_13	0	*	Have been kissed her.
c_13	0	*	Have been kissing her.
c_13	1		Stacy at the palace danced.
c_13	1		Stacy had arrived palace.
c_13	0	*	There was three man palace.
c_13	0	*	There have arrived three mans palace.
c_13	0	*	Is seeming Sonny to love Cher.
c_13	0	*	Bill have been bit that dog.
c_13	0	*	Donny is like likely that left.
c_13	1		Shah sleeped one bed.
c_13	1		Bed have been slept in by Shah.
c_13	1		Dust had fallen on bed.
c_13	0	*	Bed have been fell by dusts.
c_13	1		Bill have been hitting by baseballs.
c_13	0	*	Have been hitting by Bill by baseballs.
c_13	1		Bill had given Sue book.
c_13	1		Sue have been given that book by Bill.
c_13	0	*	Book have been given by Bill by Sue.
c_13	1		Have cut that soft bread.
c_13	1		That soft breads cut easily.
c_13	1		That boat sinked.
c_13	1		That torpedo had sunk that boat.
c_13	1		Captain sunk boat.
c_13	1		That captain with a torpedo sank that boat.
c_13	0	*	Have Been sank by boat.
c_13	1		Boat have been sunk by the torpedo captain.
c_13	1		Have sent book Louis.
c_13	1		Have sent Louis the book.
c_13	1		The book have been to Louis sent.
c_13	0	*	Louis have been sending book to.
c_13	0	*	To Louis have been sent the book.
c_13	1		Louis have been sent the book.
c_13	0	*	Book have been sent Louis.
c_13	1		John is seeming to have left.
c_13	1		Bill is wanting that John should leave.
c_13	1		John is wanting that Bill should leave.
c_13	1		John is wanting to leave.
c_13	1		John is believing to have been at game.
c_13	1		Is at the game believed by John to have been.
c_13	1		Is at the game believed to have been.
c_13	1		Becky had bought syntaxes book.
c_13	1		What-all Becky buy?
c_13	1		What-what Stacy say Becky had bought?
c_13	1		Matt had kissed her.
c_13	1		Whom-all Matt kissed?
c_13	1		Am wondering who-all Did Jim kiss.
c_13	1		A fact that am liking are strawberrying flavored milk shakes of your business is none.
c_13	1		For you made that outrageous claim that tuna flavored milkshake are like good.
c_13	1		I asked where did you find.
c_13	1		Won't revealing place.
c_13	1		Have asked who-who had kissed.
c_13	1		Am knowing several persons who had kissed.
c_13	1		I am knowing several persons herself kissed them.
c_13	1		Am knowing several persons which what had kissed.
c_13	1		I am knowing I buying book y'all recommended it.
c_13	1		Am knowing have bought book what which have recommended.
c_13	1		A guy wearing a red just had hit me hat!
c_13	1		That guy, might who am thinking be like drunk, just had hit me!
c_13	0	*	That man, who-who think them might be like drunk, that is escaping hitted me.
c_13	1		What-what Bill claim that had read?
c_13	1		What-what think Matt had kissed?
c_13	0	*	What-all Bill in the syntax book make the claim that had read?
c_13	0	*	Which cake are seeing that man who bake?
c_13	1		I am wondering what-what Did John buy.
c_13	1		How think John had bought sweater?
c_13	0	*	How are y'all wondering what-what John had bought?
c_13	1		How thinking John had bought what?
c_13	1		Am wondering what-all Did John buy how.
c_13	1		Am wondering what-what John had kissed.
c_13	0	*	Who-who are wondering what-what kissed?
c_13	1		Have asked what-what John had kissed.
c_13	1		That polouses would arrest several rioters were certaintys.
c_13	1		Have liked Mary and John.
c_13	0	*	Who-who liked and John?
c_13	1		Have eaten some popcorn and are dranking some sodas.
c_13	0	*	Eat some popcorn What and drink?
c_13	1		Who-who is loving who?
c_13	1		Who-who is loving whom?
c_13	1		Shelly is loving who?
c_13	1		Fred seen spaceship in that linguistics lounge?
c_13	1		What-all bothering y'all?
c_13	1		Who-all saw my snorkel?
c_13	1		How had been plot discovered by authorities?
c_13	1		Which animal are appearing to have lost their collar?
c_13	1		What-all Jean thinking have been like likely to have been stolen?
c_13	1		Car sales have surprised stockbroker.
c_13	1		Can y'all find light bulb store?
c_13	1		John have been bit by advertisings executive.
c_13	1		Is like likely that Tami would leave New York.
c_13	1		Tami is like likely to leave New York.
c_13	1		Lucy seem to have been mugged.
c_13	1		What-what buy that supermarket?
c_13	1		What-all at the supermarket is like likely for Beth to have bought?
c_13	1		What-what like likely to have been bought at that supermarket?
c_13	1		Trail have walked today have been built by slave labors.
c_13	1		Bill always complaining guys what that is working him.
c_13	1		Cost of bagel that are imported from Iceland had surprised teacher who Mike had hired last week.
c_13	0	*	Josh had given Clay carefully the book.
c_13	1		Josh had given Clay the book carefully.
c_13	1		Briana had shown Justin himself.
c_13	0	*	Briana had shown himself Justin.
c_13	1		Have blown up building.
c_13	1		Have blown building up.
c_13	0	*	Have blown up.
c_13	1		Have blown up.
c_13	1		Susan to Heidi sent package.
c_13	1		Have asked Mike if had saw a Yeti.
c_13	1		For Manuel bought some flower.
c_13	1		I have bought some flowers Manuel.
c_13	1		Jean is like likely to leave.
c_13	1		Jean is like reluctant to leave.
c_13	0	*	Jean is like likely.
c_13	1		Jean is wanting that Brian should leave.
c_13	1		Jean had persuaded Brian to leave.
c_13	1		That Jean leave is like likely.
c_13	1		Is like likely that Jean leave.
c_13	0	*	Is like likely Jean to leave.
c_13	0	*	Is like reluctant that Jean had left.
c_13	0	*	That Jean had left is like reluctant.
c_13	1		Jean is like likely to dance.
c_13	1		Cat bag.
c_13	1		That cat is thinking that is out of that bag.
c_13	0	*	Is like likely Are Jeaning dances.
c_13	1		Is like likely that Jean would dance.
c_13	1		Jean is wanting Robert.
c_13	1		Jean is wanting him.
c_13	0	*	Am wanting to dance.
c_13	1		Am wanting Jean.
c_13	1		Am wanting Jean to dance.
c_13	1		Jean is wanting that herself should dance.
c_13	1		Jean is like reluctant.
c_13	1		To find the new mate, are going to the dating service.
c_13	1		Jean tryna behave.
c_13	1		Robert is knowing that is like essential to be like well behaved.
c_13	1		Robert is knowing that is like essential.
c_13	1		Robert is knowing is like essential that is like well behaved.
c_13	1		Louis have begged Kate to leave.
c_13	0	*	Louis have begged Kate that is leaving her job.
c_13	0	*	Louis have begged Kate to shave himself.
c_13	1		Louis have begged Kate that be allowed to shave himself.
c_13	1		To behave oneself publics is expected.
c_13	1		Robert know that was like necessary to behave himself.
c_13	1		Mike expecting Greg incorrectly to take out trash.
c_13	1		Boy aren't all wanting to leave.
c_13	1		Robert is like eager to do hi homeworks.
c_13	1		Jean is seeming to be one good mood.
c_13	1		Rosemary had tried to get the new car.
c_13	1		Susan had begged to let is singing concert Bill.
c_13	1		Susan beg to be allowed to sing in a concert.
c_13	1		Christina is like ready to leave.
c_13	1		Fred have been believed to have wanted to try to dance.
c_13	1		Susan consenting to try to seem to have been kissed.
c_13	1		Alan telled me did who want to seem to be like invincible.
c_13	1		What-all John want to eat?
c_13	1		This book is like easy to read.
c_13	1		John is like easy to please.
c_13	1		To improve myself for next year is goal.
c_13	1		To improve yourselves would be the good idea.
c_13	1		To improve himself, Bruce should considering therapy.
c_13	1		To improve , Jane had gone one the health spa herself.
c_13	1		Kathleen really is hating her job.
c_13	1		My brother is liking collecting jazz record.
c_13	1		Martina of spiders is like deathly afraid.
c_13	1		That kind behaviors is annoying me.
c_13	1		Newses pleased students.
c_13	1		Horrors film are disturbing Milo.
c_13	1		Exhibition really impress critic.
c_13	1		Kathleen is hating that pictures of herself.
c_13	1		Childs admiring each other photos.
c_13	1		Sandra hate reading herself a tabloids.
c_13	1		Pictures of himself always are disturbing Milo.
c_13	1		To be like able to buy myself the ticket to France will be the dream.
c_13	1		Reading herself tabloids always are annoying Sandra.
c_13	1		Brandon has been reading much novels than has short stories.
c_13	1		Robin would eating cabbage which won't ices cream.
c_13	1		John could bake something, but isn't like sure what-all.
c_13	1		Frank would eating apples and Morgan would too.
c_13	1		Frank would eat apples and Morgan would eat apples too.
c_13	1		Calvin would strike himself.
c_13	1		Calvin would strike himself and Otto would too.
c_13	1		Calvin would striking and Otto would strike himself himself too.
c_13	1		Calvin dates every girl that what Jeff has them.
c_13	1		Calvin has dating every girl who Jeff has dated them.
c_13	1		Am knowing which guys  date, which amn't knowing which guys haven't.
c_13	0	*	Which language are wanting to hire someone that which is speaking?
c_13	0	*	Are wanting to hire someone is speaking the Balkan language, but amn't knowing no language.
c_13	1		Calvin would fire someone today, which amn't knowing who.
c_13	1		Peter was talking which amn't knowing who someone.
c_13	1		Brandon had read every book that Megan had done.
c_13	1		Every book that Megan had done Brandon is reading too.
c_13	1		Darin eats much than John has octopus squid.
c_13	1		What-all Calvin like.
c_13	1		Alexandra is wanting to catch the fishs and so Sylvia does too.
c_13	1		Calvin in the mirror admired himself.
c_13	0	*	Chris have said that had been like sad.
c_13	1		Chris wanting that himself should win.
c_13	1		Which pictures of himself Chris seeing in gallery?
c_13	1		Chris of himself liked which pictures?
c_13	1		Which pictures himself Chris like?
c_13	0	*	Heidi is believing Bill's description of herself.
c_13	1		Heidi is thinking that wins.
c_13	1		Heidi think that pictures herself are like beautiful.
c_13	1		Heidi had given one present to herself.
c_13	1		Army destruction of palace had been the tragedy.
c_13	1		That army had destroyed that palace.
c_13	1		Heidi is wanting to kiss herself.
c_13	0	*	Heidi is believing John's description herself.
c_13	0	*	Heidi dislike TV herself depiction.
c_13	1		Heidi had said that pictures of herself have been like embarrassing.
c_13	0	*	Heidi had said that Bill's pictures of herself have been like embarrassing.
c_13	0	*	Chris have said that had been like angry.
c_13	1		Heidi had seen Peter's picture him.
c_13	1		Heidi had seen drawing of her.
c_13	1		John is loving himself.
c_13	1		John is loving pictures of himself.
c_13	0	*	John is loving Mary pictures of himself.
c_13	0	*	John is thinking that Mary's depiction of himself is like wrong.
c_13	1		John of himself thinks that most depictions are like wrong.
c_13	1		John is seeming to like himself pictures.
c_13	1		John at baseball believes to be most best.
c_13	1		John wanting to congratulate himself.
c_13	0	*	John is loving him.
c_13	1		John is loving his puppy.
c_13	1		John had asked if the unflattering description his works would be published papers.
c_13	1		John had asked if his essay would be published in a papers.
d_98	1		Any owl can hunt mouses.
d_98	0	*	John to any woman talked.
d_98	0	*	Any woman contributing to fund.
d_98	1		John to any woman who came up to him talked.
d_98	1		Any woman that what heard newses contributed to fund.
d_98	1		Any man who had seen fly in foods isn't eating dinner.
d_98	1		Y'all may pick any flowers.
d_98	0	*	Must pick any flowers.
d_98	1		Any pilot could be flying this plane.
d_98	0	*	Any pilot must be flying this plane.
d_98	1		Any student must work hard.
d_98	1		Any doctor would tell y'all that.
d_98	1		Any soldier should be like prepared to die for her countrys.
d_98	1		John had talked to woman.
d_98	1		John isn't talking woman.
d_98	1		John had kissed even that most ugliest woman.
d_98	1		John kissing even the most ugly woman who come up to him.
d_98	1		Lion is usually like majestic.
d_98	0	*	Any lion is usually like majestic.
d_98	1		Philosopher is sometimes like wrong.
d_98	1		Any philosopher is sometimes like wrong.
d_98	1		Must picking the flowers.
d_98	1		The pilot must be flying this plane.
d_98	1		The student must work hard.
d_98	1		Soldier should be like prepared to die for her countrys.
d_98	1		Rarely is any lion majestic.
d_98	1		Seldom is any lion like majestic.
d_98	1		Never isn't any lion like majestic.
d_98	0	*	Usually, any lion is like majestic.
d_98	0	*	Often, any lion is like majestic.
d_98	0	*	Always, any lion is like majestic.
d_98	1		May pick absolutely any flowers.
d_98	1		May picking almost any flowers.
d_98	1		Almost any pilot can be flying this plane.
d_98	1		Absolutely any pilot could be flying this plane.
d_98	1		May picking any flowers rose.
d_98	1		Any pilot Sue can be flying this plane.
d_98	1		John had talked to absolutely any woman who had come up to her.
d_98	1		John had talked to almost any woman that what had come up to him.
d_98	1		John had talked any woman who had come up him Sue.
d_98	1		John had put carrot from her garden in salad.
d_98	1		John had put any carrot from hi garden in that salad.
d_98	1		John to a woman who came up to him talked.
d_98	1		One to the fund woman who heared the newses contributed.
d_98	1		The man who see fly foods isn't eating dinner.
d_98	1		John had talked to every who had come up him woman.
d_98	1		Every to the fund woman had heard the news had contributed.
d_98	1		Every man had seen fly in foods didn't eating dinner.
d_98	1		John to every woman talked.
d_98	1		Mary had regretted that had done anything to help him.
d_98	0	*	Mary to any man or any woman talked.
d_98	1		Every student in Mary's clases is working on the polarity items.
d_98	1		It of every student in Mary 's class that he is working on polarity items happens to be like true .
d_98	1		Every student in Mary's clases, by the virtue of being in his clases, working on the polarity item.
d_98	1		Every student in Mary's clas had happened to vote Republican.
d_98	1		Every woman standing under that tree is Mary's friend.
d_98	1		President in the thanked every soldier who had fought.
d_98	1		Everybody who had attended last week's huge rally had signed that petition.
d_98	1		Aren't keeping list names, but President had thanked every soldier who had fought Gulf War.
d_98	0	*	Every student Mary's clases, whoever have been, had happened to vote Republican.
d_98	0	*	Every woman standing that tree, whoever he may be, is Mary friend.
d_98	0	*	Any student in Mary's clases had happened to vote.
d_98	0	*	Any woman standing under that tree is Mary's friend.
d_98	1		Those President had thanked any soldier who had fought in those Gulf.
d_98	1		Every restaurant that is advertising in any of this papers is happening to have four star in handbook.
d_98	1		Everybody what which is Mary semantics seminar writing the paper the polarity items.
d_98	1		John to any woman at the party talked.
d_98	1		John had talked to any politician who is like powerful.
d_98	0	*	John talking to any powerful politician.
d_98	1		Mary confidently had answered any objections.
d_98	1		After dinner, throw away any leftovers.
d_98	0	*	John had bought any picture Queen Elizabeth.
d_98	1		John had bought any picture Queen Elizabeth that had been sales.
d_98	1		Every philosopher is sometimes like wrong, but usually isn't admitting.
d_98	0	*	Any lion is like generally majestic.
d_98	0	*	Any lion is like rare.
d_98	1		Any female tiger oranges fur, marked black stripes.
d_98	1		Birds are flying.
d_98	1		Any bird fly.
d_98	1		All fugitive in jail are now.
d_98	1		All lizard die.
d_98	0	*	Yesterday John talking to any woman.
d_98	1		Yesterday John had talked any woman had seen.
d_98	1		Snow is like white and snows isn't like white.
d_98	1		Any man isn't eating dinner.
d_98	1		Mary to any student talks.
d_98	0	*	Mary to any angry student talked.
d_98	1		Mary had talked to any student that what had been like angry.
d_98	0	*	Mary talk any actual student.
d_98	0	*	Any pilot on the duty today must be flying this plane.
d_98	1		Any pilot must be out flying planes today.
d_98	1		Every student on giraffes read any book found it.
d_98	0	*	Must in this bed pick any flowers.
d_98	1		Y'all may of the flowers pick any.
d_98	0	*	Must pick any of flowers.
d_98	0	*	Mary had picked any flowers.
d_98	1		Y'all may pick every flowers.
d_98	1		May for Mary pick any flowers, which are leaving few.
d_98	1		May pick any five flower.
d_98	1		Mary isn't picking any of flowers.
d_98	1		Are Picking any flowers.
d_98	1		Are Confiscating any liquor.
d_98	1		Are Picking any of this flowers.
d_98	0	*	Are Confiscating any of this liquor.
d_98	0	*	Mary didn't saw almost every flowers.
d_98	0	*	Mary didn't saw almost any flowers.
d_98	1		Every student Mary clases working negative polarity.
d_98	1		There have been twenty student at lecture and every student what which had been there had said had been like inspiring.
d_98	0	*	There was twenty student at lecture and any student what which was there said was like inspiring.
d_98	1		Have many graduate students but still this year graduate director had met with every student in graduate program individually to discuss their progreses.
d_98	0	*	Have many graduate students but still this year graduate director had met with any student in graduate program individually to discuss their progreses.
d_98	1		Susan had found every been looking it for Borders book.
d_98	0	*	Susan at Borders found any book had been looking it for.
d_98	1		Paul already interviewed every student who had been scene crimes and Kate interviewed them too.
d_98	0	*	Paul has interviewed any student who had been at that scene of that crimes and Kate has interviewed them too.
d_98	0	*	Professor Smith will support Sue and Prof Jones Bill.
d_98	1		There by Chomsky in this library is every book.
d_98	0	*	You have any book Chomsky this library.
d_98	1		There's everything Mary had asked it for in this store.
d_98	0	*	There's anything Mary had asked it for in this store.
d_98	1		You have any book could imagine it in this library.
d_98	1		There's anything could desire it in this store.
d_98	1		That evening John had laughed with everybody had talked.
d_98	1		That evening John had laughed with anybody had talked.
d_98	1		John to everybody who came up to him at the party talked.
d_98	1		John had talked to anybody who had come up to her at party.
d_98	1		Bill had offered Mary everything had cooked for dinner.
d_98	0	*	Bill for dinner offered Mary anything cooked it.
d_98	1		That day Bill had offered Mary everything had cooked.
d_98	1		Those day Bill offer Mary anything cook.
d_98	1		John had made one fool of himself in front of everyone that what had been there.
d_98	1		John of himself in front of anyone who was there made one fool.
d_98	1		Mary for everyone who wanted to hear her sang.
d_98	1		Mary sung for anyone which that wanted to hear her.
d_98	1		John had slipped front everyone what that had been there.
d_98	0	*	John in front of anyone who was there slipped.
d_98	1		John on our trip knew every language what which encountered it.
d_98	1		John had known any language that have encountered our trip.
d_98	1		John before him liked everything that was placed it.
d_98	1		John had liked anything what which have been placed it before him.
d_98	1		At end of his speechs, president had thanked any soldier who had fought in gulf war.
d_98	1		Bob is not thinking that you have anyone from Greece in his basement.
d_98	1		Anyone can pledge $ 1000, isn't it?
d_98	1		Like possible for everyone to to pledge $1000?
d_98	1		You have someone can pledge $1000?
d_98	1		If anybody is coming, is ringing doorbell.
d_98	1		Every student who is winning any trophy is displaying the prominent place.
d_98	0	*	John seed anything.
d_98	1		John isn't seeing anything.
d_98	0	*	Some who is reading anything passed.
d_98	1		Every who had read anything passing.
d_98	1		No student who readed anything passed.
d_98	0	*	Some had answered any question.
d_98	0	*	Every student had answered any question.
d_98	1		Any cat isn't liking mouses.
d_98	1		Every cat isn't liking mouses.
d_98	1		Every cat isn't liking mouses, for example Felix doesn't.
d_98	1		Almost every cat is liking mouses, but still Felix doesn't.
d_98	0	*	Every cat isn't liking mouses, but still Felix doesn't.
d_98	1		Almost every cat for example likes mouses, Felix don't.
g_81	1		Dodgers have beaten Red Sox and Dodgers have been beaten by Giant.
g_81	1		Dodgers have beaten Red Sox and Giant have beaten Dodgers.
g_81	1		Different teams have beaten Red Sox and have been beaten by Giants.
g_81	1		John to Sue gave book to Mary and record.
g_81	1		How many y'all buy of that py at a fair?
g_81	1		how many gave this books this person.
g_81	0	*	Man had chased Fido had returned.
g_81	1		Man had chased Fido had returned.
g_81	1		Man am thinking chased Fido had returned.
g_81	0	*	Man think them that had chased Fido had returned.
g_81	1		Man who-who think them had chased Fido had returned.
g_81	0	*	Man who think them that chase Fido return.
g_81	1		Who-all are thinking Mary see?
g_81	1		How slowly would you say was drove?
g_81	1		Like How suspicious had been Mary?
g_81	1		Who-all had seen that man?
g_81	1		Who-who are thinking that have seen?
g_81	0	*	Who-all think that had seen you?
g_81	1		Who-who regretting that have seen?
g_81	0	*	Who-all regret had seen you?
g_81	1		Who-who thinking have seen?
g_81	1		Who-all think have seen you?
g_81	0	*	Who-who regret have seen?
g_81	0	*	Who-who regret have seen you?
g_81	0	*	Who-who believed that had come?
g_81	0	*	Who-who wondering whether have come?
g_81	0	*	Who-all you wondering if have come?
g_81	0	*	Who-who arranged to come?
g_81	0	*	Which table are wondering on Kim have put book?
g_81	0	*	Which buy table on Kim have put book?
g_81	0	*	What-all are y'all believing that irons are to be one facts well known to virtually everybody?
g_81	0	*	Who-all wonder seed Kim?
g_81	0	*	Which y'all buy table support book?
g_81	0	*	Fact, have put down to that Kim had come.
g_81	0	*	A table, on which put Kim supported a book.
g_81	1		Who-who is it that Mary is liking?
g_81	1		Had been like talkative.
g_81	1		She were bullys.
g_81	1		Had been like talkative and the bullys.
g_81	0	*	That talkative and one bullys man had entered.
g_81	0	*	Talkative and the bullys entered.
g_81	0	*	John is like easy to please and to love Mary.
g_81	0	*	A man who Mary loves them and Sally hating George had computed my tax.
g_81	1		John is like easy to please and to love.
g_81	1		That kennel which Mary made it and so Fido is sleeping in been stolen.
g_81	1		That kennel which is keeping drug and Fido sleep has been stealing.
g_81	0	*	Kennel which Mary made it and Fido sleep been stolen.
g_81	1		John had seen more horse than Bill had seen or Pete had talked.
g_81	1		John to cats saw much horses than Bill saw cows or Pete talked.
